{
  "snippet_id": "warfarin_interactions_01",
  "text": "Warfarin interacts with many commonly used drugs. Nonsteroidal anti-inflammatory drugs increase the risk of gastrointestinal bleeding. Many antibiotics increase the effect of warfarin by reducing its metabolism.",
  "source": "https://en.wikipedia.org/wiki/Warfarin",
  "meta": { "drug": "Warfarin", "section": "Interactions" }
}