{
  "snippet_id": "atorvastatin_medical_uses_01",
  "text": "The primary uses of atorvastatin are for the treatment of dyslipidemia and for the prevention of cardiovascular disease.",
  "source": "https://en.wikipedia.org/wiki/Atorvastatin",
  "meta": {
    "drug": "Atorvastatin",
    "section": "Medical uses"
  }
}
