{
  "snippet_id": "metformin_adverse_effects_01",
  "text": "The most common adverse effect of metformin is gastrointestinal irritation, including diarrhea, cramps, nausea, vomiting, and increased flatulence. Metformin is more commonly associated with gastrointestinal adverse effects than most other antidiabetic medications. The most serious potential adverse effect of metformin is lactic acidosis; this complication is rare, and seems to be related to impaired liver or kidney function.",
  "source": "https://en.wikipedia.org/wiki/Metformin",
  "meta": {
    "drug": "Metformin",
    "section": "Adverse effects"
  }
}
