{
  "snippet_id": "morphine_medical_uses_opioid_use_disorder_01",
  "text": "Morphine is used in a slow-release formulation for opiate substitution therapy (OST) in Austria, Germany, Bulgaria, Slovenia, and Canada for persons with opioid addiction who cannot tolerate either methadone or buprenorphine.",
  "source": "https://en.wikipedia.org/wiki/Morphine",
  "meta": {
    "drug": "Morphine",
    "section": "Medical uses / Opioid use disorder"
  }
}
