{
  "snippet_id": "hydrocortisone_lead_class_use_mechanism_01",
  "text": "Hydrocortisone is the name for the hormone cortisol when supplied as a medication. It is a corticosteroid and works as an anti-inflammatory and by immune suppression. Uses include conditions such as adrenocortical insufficiency, adrenogenital syndrome, high blood calcium, thyroiditis, rheumatoid arthritis, dermatitis, asthma, and COPD.",
  "source": "https://en.wikipedia.org/wiki/Hydrocortisone",
  "meta": {
    "drug": "Hydrocortisone",
    "section": "Lead"
  }
}
