{
  "snippet_id": "hydrocortisone_medical_uses_rectal_01",
  "text": "It may also be used rectally in suppositories to relieve the swelling, itch, and irritation in hemorrhoids.",
  "source": "https://en.wikipedia.org/wiki/Hydrocortisone",
  "meta": {
    "drug": "Hydrocortisone",
    "section": "Medical uses"
  }
}
