{
  "snippet_id": "metformin_weight_change_01",
  "text": "Metformin use is typically associated with weight loss. It appears to be safe and effective in counteracting the weight gain caused by the antipsychotic medications olanzapine and clozapine.",
  "source": "https://en.wikipedia.org/wiki/Metformin",
  "meta": {
    "drug": "Metformin",
    "section": "Medical uses / Weight change"
  }
}
