{
  "snippet_id": "atorvastatin_interactions_02",
  "text": "This is less likely to happen with other CYP3A4 inhibitors such as diltiazem, erythromycin, fluconazole, ketoconazole, clarithromycin, cyclosporine, protease inhibitors, or verapamil, and only rarely with other CYP3A4 inhibitors, such as amiodarone and aprepitant.",
  "source": "https://en.wikipedia.org/wiki/Atorvastatin",
  "meta": {
    "drug": "Atorvastatin",
    "section": "Side effects / Interactions"
  }
}
