{
  "snippet_id": "aspirin_pain_01",
  "text": "Aspirin is an effective analgesic for acute pain, although it is generally considered inferior to ibuprofen because aspirin is more likely to cause gastrointestinal bleeding.",
  "source": "https://en.wikipedia.org/wiki/Aspirin",
  "meta": {
    "drug": "Aspirin",
    "section": "Medical use / Pain"
  }
}
