{
  "snippet_id": "paracetamol_lead_adverse_01",
  "text": "Chronic consumption of paracetamol may result in a drop in hemoglobin level, indicating possible gastrointestinal bleeding, and abnormal liver function tests.",
  "source": "https://en.wikipedia.org/wiki/Paracetamol",
  "meta": {
    "drug": "Paracetamol",
    "section": "Lead"
  }
}
