{
  "snippet_id": "aspirin_contraindications_01",
  "text": "Aspirin should not be taken by people who are allergic to ibuprofen or naproxen, or who have salicylate intolerance or a more generalized drug intolerance to NSAIDs, and caution should be exercised in those with asthma or NSAID-precipitated bronchospasm.",
  "source": "https://en.wikipedia.org/wiki/Aspirin",
  "meta": {
    "drug": "Aspirin",
    "section": "Adverse effects / Contraindications"
  }
}
