{
  "snippet_id": "morphine_lead_pregnancy_warning_01",
  "text": "Caution is advised for the use of morphine during pregnancy or breastfeeding, as it may affect the health of the baby.",
  "source": "https://en.wikipedia.org/wiki/Morphine",
  "meta": {
    "drug": "Morphine",
    "section": "Lead"
  }
}
