{
  "snippet_id": "metformin_lactic_acidosis_02",
  "text": "Common causes include alcoholism (due to depletion of NAD+ stores), heart failure, and respiratory disease (due to inadequate tissue oxygenation); the most common cause is kidney disease.",
  "source": "https://en.wikipedia.org/wiki/Metformin",
  "meta": {
    "drug": "Metformin",
    "section": "Adverse effects / Lactic acidosis"
  }
}
